Category,Name,Description,Location,When_to_Visit,Cultural_Significance
Festival,Chinese New Year Parade,One of the oldest and largest celebrations of its kind outside Asia,Chinatown,January/February (varies by lunar calendar),Very High - Over 150 years of history celebrating Chinese heritage
Festival,San Francisco Pride,One of the largest and oldest LGBTQ+ celebrations in the world,Market Street & Civic Center,Last weekend of June,Very High - Historic center of LGBTQ+ rights movement
Festival,Outside Lands,Major music and arts festival in urban park setting,Golden Gate Park,Early August,Medium - Contemporary cultural gathering showcasing music and food
Festival,Hardly Strictly Bluegrass,Free annual music festival spanning multiple genres,Golden Gate Park,Early October,High - Represents SF's tradition of accessible arts
Festival,Carnaval San Francisco,Two-day festival celebrating Latin American and Caribbean cultures,Mission District,Memorial Day Weekend,High - Celebrates Latino cultural heritage
Festival,Fillmore Jazz Festival,Largest free jazz festival on the West Coast,Fillmore District,Fourth of July Weekend,High - Honors historic jazz district heritage
Festival,Folsom Street Fair,World's largest leather and BDSM event,SoMa District,Late September,High - Unique celebration of alternative sexuality and self-expression
Festival,Cherry Blossom Festival,Annual celebration of Japanese culture,Japantown,April,High - Honors Japanese-American cultural contributions
Festival,Litquake,Literary festival featuring hundreds of authors,Various venues citywide,October,Medium - Reflects SF's literary traditions
Landmark,Golden Gate Bridge,Iconic suspension bridge and global symbol of San Francisco,Northern edge of SF Peninsula,Year-round (best viewed morning or sunset),Very High - Most recognizable symbol of the city
Landmark,Alcatraz Island,Former federal prison with Native American occupation history,San Francisco Bay,Year-round (advance tickets recommended),High - Complex history of incarceration and resistance
Landmark,Cable Cars,Last manually operated cable car system in the world,"Powell-Hyde, Powell-Mason, and California Street lines",Year-round (less crowded early morning),Very High - Living piece of transportation history
Landmark,Painted Ladies,Victorian and Edwardian houses painted in three or more colors,Alamo Square (most famous row),Year-round (golden hour for photography),High - Symbol of SF's architectural heritage
Landmark,Coit Tower,Art Deco tower with Depression-era murals,Telegraph Hill,Year-round,High - Features WPA murals reflecting social issues of 1930s
Landmark,City Lights Bookstore,Historic independent bookstore and publisher,North Beach,Year-round,High - Epicenter of Beat Generation literature
Landmark,Chinatown Gate,Entrance to oldest Chinatown in North America,Grant Avenue & Bush Street,Year-round,High - Gateway to significant Chinese-American community
Landmark,Castro Theatre,Historic movie palace and LGBTQ+ landmark,Castro District,Year-round,High - Cultural heart of LGBTQ+ neighborhood
Landmark,Mission Dolores,Oldest intact building in San Francisco,Mission District,Year-round,High - Represents Spanish colonial history and Native American impact
Cuisine,Sourdough Bread,San Francisco's distinctive bread with unique tangy flavor,Boudin Bakery (Fisherman's Wharf) and other local bakeries,Year-round,High - Culinary tradition dating back to Gold Rush era
Cuisine,Mission-Style Burrito,Oversized burrito wrapped in foil originated in SF,Mission District taquerias like La Taqueria and El Farolito,Year-round,High - SF's contribution to Mexican-American cuisine
Cuisine,Cioppino,Italian-American fisherman's stew created in SF,North Beach restaurants like Sotto Mare,Year-round (best in winter),Medium - Reflects Italian fishing community's influence
Cuisine,Dim Sum,Traditional Cantonese small-plate dining experience,Chinatown and Richmond District restaurants,Year-round (busiest on weekends),High - Signature of SF's Chinese culinary heritage
Cuisine,Dungeness Crab,Local seafood delicacy,"Fisherman's Wharf, Swan Oyster Depot",November-June (peak season),High - Iconic Bay Area seasonal seafood
Cuisine,Coffee Culture,Third-wave specialty coffee scene,Independent cafes citywide,Year-round,Medium - Pioneering specialty coffee movement
Cuisine,Farm-to-Table Movement,"Emphasis on local, sustainable ingredients",Restaurants throughout the city,Year-round,High - SF helped pioneer sustainable dining practices
Cuisine,Fortune Cookies,Crisp cookies with paper fortunes invented in SF,Golden Gate Fortune Cookie Factory in Chinatown,Year-round,Medium - Chinese-American cultural fusion
Cuisine,Ghirardelli Chocolate,Historic chocolate company founded during Gold Rush,Ghirardelli Square in Fisherman's Wharf,Year-round,Medium - Historic SF confectionery tradition
Arts,SF Museum of Modern Art,Internationally renowned modern art museum,SoMa District,Year-round (closed Wednesdays),High - Major collection of 20th century art
Arts,Mission District Murals,Vibrant outdoor murals reflecting Latino culture and social issues,"Balmy Alley, Clarion Alley, 24th Street",Year-round (daylight hours best),High - Expression of Chicano identity and political activism
Arts,SF Symphony,Grammy-winning orchestra,Davies Symphony Hall,September-June season,High - World-class classical music institution
Arts,American Conservatory Theater,Tony Award-winning nonprofit theater company,Geary Theater and Strand Theater,Year-round (seasonal performances),Medium - Cornerstone of SF theater scene
Arts,SF Opera,Second largest opera company in North America,War Memorial Opera House,Fall and Summer seasons,High - Major cultural institution since 1923
Arts,SF Ballet,Oldest professional ballet company in America,War Memorial Opera House,December-May season,High - Pioneer in American dance
Arts,Fillmore Music Scene,Historic jazz and rock music district,Fillmore District,Year-round (performances at night),High - Once known as 'Harlem of the West'
Arts,Beat Poetry,Literary movement centered in North Beach,North Beach neighborhood,Year-round,High - Revolutionary cultural movement of the 1950s
Arts,Contemporary Jewish Museum,Modern museum exploring Jewish culture and history,SoMa District,Year-round (closed Wednesdays),Medium - Innovative cultural exhibitions
Neighborhood,Chinatown,Oldest and one of the largest Chinatowns in North America,Between Financial District and North Beach,Year-round (Chinese New Year for festivals),Very High - Cultural enclave since 1850s
Neighborhood,Mission District,Latino cultural center with hipster influences,Eastern portion of city,Year-round,High - Center of Latino culture with murals and food
Neighborhood,Castro,Internationally famous LGBTQ+ neighborhood,Eureka Valley area,Year-round (Pride weekend for celebrations),Very High - Global symbol of LGBTQ+ rights and culture
Neighborhood,North Beach,Historic Italian-American district and Beat movement center,Northeast quadrant,Year-round,High - Literary and Italian-American heritage
Neighborhood,Haight-Ashbury,Epicenter of 1960s counterculture and hippie movement,Eastern end of Golden Gate Park,Year-round,High - Symbol of 1960s Summer of Love
Neighborhood,Japantown,One of three remaining Japantowns in the United States,Western Addition,Year-round (Cherry Blossom Festival in April),High - Center of Japanese-American community
Neighborhood,SoMa,Post-industrial area transformed by tech and arts,South of Market Street,Year-round,Medium - Represents SF's evolution from industrial to digital
Neighborhood,Fillmore,Historic African-American cultural district,Western Addition,Year-round (Jazz Festival in summer),High - Once known as the 'Harlem of the West'
Neighborhood,Noe Valley,Family-friendly neighborhood with Victorian architecture,Central SF,Year-round,Low - Represents traditional SF neighborhood character
Tradition,Bay to Breakers,Century-old footrace known for costumes and revelry,From downtown to Ocean Beach,Third Sunday in May,High - Uniquely San Franciscan blend of sport and celebration
Tradition,Critical Mass,Monthly bicycle protest/celebration,Starts at Justin Herman Plaza,Last Friday of every month,Medium - Started in SF and spread globally
Tradition,Burning Man,Art event with SF roots now held in Nevada,"Originally Baker Beach, now Black Rock Desert",Late August/Early September,Medium - Originated in SF before moving to desert
Tradition,Ghost hunting at Alcatraz,Night tours of reportedly haunted former prison,Alcatraz Island,Year-round (night tours),Low - Modern tradition based on historical site
Tradition,SF Mime Troupe,Political theater collective performing free shows since 1959,Parks throughout the city,July 4 through Labor Day,Medium - Radical political theater tradition
Tradition,How Weird Street Faire,Electronic music and art festival,SoMa District,First Sunday in May,Low - Represents tech-meets-counterculture ethos
Tradition,SF Giants Opening Day,Baseball tradition with celebrations along Embarcadero,Oracle Park and surrounding areas,Early April,Medium - Community celebration of baseball
Tradition,Zen Buddhism,Strong presence of Zen tradition in American Buddhism,SF Zen Center in Hayes Valley,Year-round,Medium - Important center for Buddhism in America
Tradition,Foghorns,Iconic sound of the city responding to marine layer,Golden Gate Bridge and Bay,Summer months (peak fog season),Medium - Atmospheric soundtrack of SF
Tradition,Silent Disco,Dancers with wireless headphones at outdoor locations,Various parks and public spaces,Warm evenings year-round,Low - Contemporary tradition embracing public space
